{
  "schema_version": "a-han-precise-signals-v1",
  "contract_url": "/schemas/a-han-precise-signals.schema.json",
  "generated_at": "2026-10-28T14:37:18+08:00",
  "model_version": "Han Precise Guidance Pine v6 replicate",
  "source": "local SQLite qfq daily cache",
  "observation_date": "2026-10-27",
  "universe_count": 91,
  "valid_count": 91,
  "unavailable_codes": [],
  "rows": [
    {
      "code": "162411",
      "name": "华宝油气LOF",
      "status": "ok",
      "reason": null,
      "bar_count": 400,
      "background": "红色",
      "state": "做多",
      "state_color": "红色",
      "signal_date": "2026-10-27",
      "signals": [
        {
          "name": "减仓",
          "date": "2026-10-16",
          "close": 1.001
        }
      ],
      "key_levels": {
        "support": 0.936,
        "pressure": 1.049,
        "ema15_support": 0.969,
        "ema15_resistance": null
      },
      "metrics": {
        "close": 1.085,
        "day_change_pct": 2.84,
        "ma89": 0.933,
        "ma03": 1.055,
        "bias05": 3.47,
        "bias30": 8.09,
        "bb05": 45.6,
        "bb10": 36.47,
        "bb30": 14.38,
        "k": 90.17,
        "d": 85.13,
        "macd": 0.014,
        "x_trend": 94.41,
        "gdx_qs": 88.47,
        "dx": 45.37
      }
    },
    {
      "code": "512800",
      "name": "银行ETF华宝",
      "status": "ok",
      "reason": null,
      "bar_count": 381,
      "background": "橙色",
      "state": "弱升",
      "state_color": "青色",
      "signal_date": "2026-10-27",
      "signals": [
        {
          "name": "减仓",
          "date": "2026-10-16",
          "close": 0.864
        },
        {
          "name": "DX买",
          "date": "2026-10-26",
          "close": 0.864
        },
        {
          "name": "DX加1",
          "date": "2026-10-26",
          "close": 0.864
        }
      ],
      "key_levels": {
        "support": 0.833,
        "pressure": 0.877,
        "ema15_support": 0.858,
        "ema15_resistance": null
      },
      "metrics": {
        "close": 0.88,
        "day_change_pct": 1.85,
        "ma89": 0.815,
        "ma03": 0.864,
        "bias05": 1.9,
        "bias30": 3.27,
        "bb05": 18.02,
        "bb10": 10.5,
        "bb30": 10.0,
        "k": 63.83,
        "d": 57.97,
        "macd": -0.0,
        "x_trend": 84.05,
        "gdx_qs": 73.76,
        "dx": 15.92
      }
    },
    {
      "code": "512890",
      "name": "红利低波ETF华泰柏瑞",
      "status": "ok",
      "reason": null,
      "bar_count": 381,
      "background": "橙色",
      "state": "做空",
      "state_color": "绿色",
      "signal_date": "2026-10-27",
      "signals": [
        {
          "name": "减仓",
          "date": "2026-10-15",
          "close": 1.212
        },
        {
          "name": "DX买",
          "date": "2026-10-26",
          "close": 1.213
        },
        {
          "name": "DX加1",
          "date": "2026-10-26",
          "close": 1.213
        }
      ],
      "key_levels": {
        "support": 1.18,
        "pressure": 1.236,
        "ema15_support": 1.21,
        "ema15_resistance": null
      },
      "metrics": {
        "close": 1.22,
        "day_change_pct": 0.58,
        "ma89": 1.17,
        "ma03": 1.211,
        "bias05": 0.84,
        "bias30": 1.28,
        "bb05": -2.84,
        "bb10": -1.88,
        "bb30": 3.96,
        "k": 48.35,
        "d": 48.72,
        "macd": -0.002,
        "x_trend": 66.25,
        "gdx_qs": 57.86,
        "dx": -0.24
      }
    },
    {
      "code": "513500",
      "name": "标普500ETF博时",
      "status": "ok",
      "reason": null,
      "bar_count": 381,
      "background": "橙色",
      "state": "弱升",
      "state_color": "青色",
      "signal_date": "2026-10-27",
      "signals": [
        {
          "name": "DX卖1",
          "date": "2026-10-14",
          "close": 2.74
        },
        {
          "name": "DX买",
          "date": "2026-10-27",
          "close": 2.66
        }
      ],
      "key_levels": {
        "support": 2.604,
        "pressure": 2.754,
        "ema15_support": null,
        "ema15_resistance": 2.709
      },
      "metrics": {
        "close": 2.66,
        "day_change_pct": 2.19,
        "ma89": 2.621,
        "ma03": 2.623,
        "bias05": 1.08,
        "bias30": -0.7,
        "bb05": 4.78,
        "bb10": -19.42,
        "bb30": -2.28,
        "k": 34.14,
        "d": 25.45,
        "macd": -0.019,
        "x_trend": 21.4,
        "gdx_qs": 32.63,
        "dx": -25.52
      }
    },
    {
      "code": "515180",
      "name": "红利ETF易方达",
      "status": "ok",
      "reason": null,
      "bar_count": 380,
      "background": "绿色",
      "state": "弱升",
      "state_color": "青色",
      "signal_date": "2026-10-27",
      "signals": [
        {
          "name": "DX买",
          "date": "2026-10-16",
          "close": 1.377
        },
        {
          "name": "DX买",
          "date": "2026-10-26",
          "close": 1.353
        },
        {
          "name": "底部B",
          "date": "2026-10-26",
          "close": 1.353
        }
      ],
      "key_levels": {
        "support": 1.336,
        "pressure": 1.471,
        "ema15_support": null,
        "ema15_resistance": 1.421
      },
      "metrics": {
        "close": 1.364,
        "day_change_pct": 0.81,
        "ma89": 1.394,
        "ma03": 1.351,
        "bias05": 1.07,
        "bias30": -2.66,
        "bb05": -6.75,
        "bb10": -10.76,
        "bb30": -9.7,
        "k": 32.94,
        "d": 25.25,
        "macd": -0.006,
        "x_trend": 15.58,
        "gdx_qs": 2.07,
        "dx": -20.58
      }
    },
    {
      "code": "516530",
      "name": "物流ETF银华",
      "status": "ok",
      "reason": null,
      "bar_count": 400,
      "background": "绿色",
      "state": "弱升",
      "state_color": "青色",
      "signal_date": "2026-10-27",
      "signals": [
        {
          "name": "加仓",
          "date": "2026-10-14",
          "close": 1.042
        },
        {
          "name": "清仓",
          "date": "2026-10-15",
          "close": 1.004
        },
        {
          "name": "DX买",
          "date": "2026-10-23",
          "close": 0.967
        }
      ],
      "key_levels": {
        "support": 0.958,
        "pressure": 1.051,
        "ema15_support": null,
        "ema15_resistance": 1.028
      },
      "metrics": {
        "close": 0.993,
        "day_change_pct": 0.4,
        "ma89": 0.995,
        "ma03": 0.983,
        "bias05": 1.51,
        "bias30": -2.23,
        "bb05": 4.68,
        "bb10": -24.27,
        "bb30": -4.87,
        "k": 22.64,
        "d": 19.22,
        "macd": -0.008,
        "x_trend": 19.93,
        "gdx_qs": 7.68,
        "dx": -17.87
      }
    },
    {
      "code": "159940",
      "name": "金融地产ETF广发",
      "status": "ok",
      "reason": null,
      "bar_count": 400,
      "background": "橙色",
      "state": "弱升",
      "state_color": "青色",
      "signal_date": "2026-10-27",
      "signals": [
        {
          "name": "减仓",
          "date": "2026-10-20",
          "close": 1.216
        },
        {
          "name": "DX买",
          "date": "2026-10-26",
          "close": 1.219
        }
      ],
      "key_levels": {
        "support": 1.201,
        "pressure": 1.248,
        "ema15_support": 1.216,
        "ema15_resistance": null
      },
      "metrics": {
        "close": 1.221,
        "day_change_pct": 0.16,
        "ma89": 1.202,
        "ma03": 1.214,
        "bias05": 0.78,
        "bias30": 0.09,
        "bb05": 4.72,
        "bb10": -2.35,
        "bb30": -1.72,
        "k": 53.26,
        "d": 44.45,
        "macd": -0.001,
        "x_trend": 29.69,
        "gdx_qs": 19.61,
        "dx": -1.25
      }
    },
    {
      "code": "159329",
      "name": "沙特ETF南方",
      "status": "ok",
      "reason": null,
      "bar_count": 400,
      "background": "绿色",
      "state": "弱升",
      "state_color": "青色",
      "signal_date": "2026-10-27",
      "signals": [
        {
          "name": "DX买",
          "date": "2026-10-16",
          "close": 0.839
        },
        {
          "name": "DX买",
          "date": "2026-10-27",
          "close": 0.818
        },
        {
          "name": "底部B",
          "date": "2026-10-27",
          "close": 0.818
        }
      ],
      "key_levels": {
        "support": 0.794,
        "pressure": 0.917,
        "ema15_support": null,
        "ema15_resistance": 0.917
      },
      "metrics": {
        "close": 0.818,
        "day_change_pct": 4.34,
        "ma89": 0.891,
        "ma03": 0.802,
        "bias05": 1.01,
        "bias30": -5.68,
        "bb05": -27.29,
        "bb10": -24.02,
        "bb30": -20.76,
        "k": 21.23,
        "d": 11.11,
        "macd": -0.009,
        "x_trend": 7.34,
        "gdx_qs": -3.68,
        "dx": -41.79
      }
    },
    {
      "code": "159883",
      "name": "医疗器械ETF永赢",
      "status": "ok",
      "reason": null,
      "bar_count": 380,
      "background": "橙色",
      "state": "做多",
      "state_color": "红色",
      "signal_date": "2026-10-27",
      "signals": [
        {
          "name": "DX买",
          "date": "2026-10-19",
          "close": 0.425
        },
        {
          "name": "DX加1",
          "date": "2026-10-20",
          "close": 0.435
        },
        {
          "name": "DX加1",
          "date": "2026-10-23",
          "close": 0.441
        },
        {
          "name": "加仓",
          "date": "2026-10-23",
          "close": 0.441
        },
        {
          "name": "减仓",
          "date": "2026-10-27",
          "close": 0.436
        }
      ],
      "key_levels": {
        "support": 0.422,
        "pressure": 0.449,
        "ema15_support": 0.432,
        "ema15_resistance": null
      },
      "metrics": {
        "close": 0.436,
        "day_change_pct": -3.54,
        "ma89": 0.434,
        "ma03": 0.443,
        "bias05": -0.46,
        "bias30": 0.38,
        "bb05": 2.62,
        "bb10": 2.65,
        "bb30": -2.64,
        "k": 63.01,